<?xml version="1.0" encoding="UTF-8"?>
<!DOCTYPE students [
<!ELEMENT students (student+)>
<!ELEMENT student (name, age, contact, address)>
<!ATTLIST student
    id ID #REQUIRED
    program CDATA #REQUIRED
>
<!ELEMENT name (firstName, lastName)>
<!ELEMENT firstName (#PCDATA)>
<!ELEMENT lastName (#PCDATA)>
<!ELEMENT age (#PCDATA)>
<!ELEMENT contact (email, phone)>
<!ELEMENT email (#PCDATA)>
<!ELEMENT phone (#PCDATA)>
<!ATTLIST phone
    type (mobile|home|work) #REQUIRED
>
<!ELEMENT address (street, city, state, zip)>
<!ELEMENT street (#PCDATA)>
<!ELEMENT city (#PCDATA)>
<!ELEMENT state (#PCDATA)>
<!ELEMENT zip (#PCDATA)>
]>
<students>
    <student id="S001" program="B.Tech">
        <name>
            <firstName>John</firstName>
            <lastName>Doe</lastName>
        </name>
        <age>21</age>
        <contact>
            <email>john.doe@example.com</email>
            <phone type="mobile">1234567890</phone>
        </contact>
        <address>
            <street>123 Main Street</street>
            <city>New York</city>
            <state>NY</state>
            <zip>10001</zip>
        </address>
    </student>
    <student id="S002" program="MCA">
        <name>
            <firstName>Jane</firstName>
            <lastName>Smith</lastName>
        </name>
        <age>23</age>
        <contact>
            <email>jane.smith@example.com</email>
            <phone type="home">9876543210</phone>
        </contact>
        <address>
            <street>456 Elm Street</street>
            <city>Los Angeles</city>
            <state>CA</state>
            <zip>90001</zip>
        </address>
    </student>
</students>
